{
  "schema_version": "1.0.0",
  "umbilical_id": "prontopc-loyalty-umbilical",
  "pod_id": "prontopc-pod",
  "orb_id": "prontopc-loyalty",
  "attachment_point": "cloudrun-portal",
  "runtime": { "language": "javascript", "form": "http_service" },
  "invocation": {
    "entrypoint": "pronto-server-cloudrun.mjs:ensureNextRepairCoupon|createMakeGoodCoupon",
    "orb_version": "1.0.0"
  },
  "input_contract": {
    "description": "Two triggers, both from a live paid session. Next-repair: a completed run. Make-good: a report that both AI authors declined, carrying token + machine identity.",
    "next_repair": { "token": "string (completed session)" },
    "make_good": { "token": "string", "machineId": "string", "machineName": "string", "reason": "string" }
  },
  "output_contract": {
    "description": "A single-use coupon code, or an honest no-op. Absent Stripe keys degrade gracefully to ok with couponCode null - never a fabricated code, never a blocked run.",
    "ok": "boolean",
    "couponCode": "string | null",
    "kind": "next_repair (50%) | make_good (100%)"
  },
  "observation_contract": {
    "description": "Loyalty attaches AFTER the service and never affects it: it authors no plan, gates no state, blocks nothing. The make-good is the honest terminal recourse on AI failure (not a non-AI plan); the next-repair coupon is presented, never pushed (no-force ethos). The Custodian may PRESENT a coupon, but the coupon itself is minted only here.",
    "events": [
      "coupon.presented { code, kind: next_repair }",
      "makegood.issued { code, email, machine }"
    ]
  },
  "evidence_contract": {
    "description": "Coupons are real Stripe promotion codes (single-use), tagged with email + machine metadata; the make-good also sends the customer email + a Support incident. The issued code is the after-the-fact evidence of the honest recourse."
  },
  "working_parameters": {
    "status": "provisional",
    "outside_parameters_behavior": "Missing Stripe/Resend keys -> ok with couponCode null (honest no-op), never a fabricated code. A make-good is idempotent per session. No loyalty path can block, gate, or delay the paid repair flow."
  }
}
