{
  "schema_version": "1.0.0",
  "umbilical_id": "prontopc-mint-portal-umbilical",
  "pod_id": "prontopc-pod",
  "orb_id": "prontopc-mint-portal",
  "attachment_point": "asset-pipeline",
  "runtime": { "language": "javascript", "form": "http_service" },
  "invocation": {
    "entrypoint": "Mint MCP asset pipeline (three.js / model + material generation) - NOT wired into the shipping product",
    "orb_version": "1.0.0"
  },
  "input_contract": {
    "description": "HONEST STATUS: RETIRED (TOTEM-C-0130). The Mint asset-generation pipeline (3D models / materials / animated assets) was an OPTIONAL outward tool; it is superseded by the shipping Custodian's pure-vector, ZERO-ASSET Actuator (StoreApp/Custodian.xaml, TOTEM-0035) and is not on the product path. Retained + marked, not erased (append-only); required_for_full_function:false, no active specs.",
    "asset_request": "object (a generation brief) - not issued by the shipping app"
  },
  "output_contract": {
    "description": "Generated visual assets, if ever used. Currently unused: the product ships no Mint-generated asset.",
    "asset": "binary/reference - not consumed by the shipping product"
  },
  "observation_contract": {
    "description": "RETIRED and marked, not erased (aegis-append-only-invariant): the Mint pipeline is superseded by the zero-asset vector Custodian and is not part of the product path. The manifest records it non-required with no active specs. If the product ever adds generated art, a NEW Orb/Portal is attached (append-only) rather than reviving this retired record.",
    "events": []
  },
  "evidence_contract": {
    "description": "No shipping evidence: the Release build bundles no Mint-generated asset (the Custodian is pure-vector). This umbilical records intent + the attachment point, not an active dependency."
  },
  "working_parameters": {
    "status": "draft",
    "outside_parameters_behavior": "RETIRED: not invoked by the shipping product and not on the path. The Custodian renders as a zero-asset vector Actuator; nothing depends on this Portal. Retained as an append-only record of a superseded outward capability."
  }
}
